{
  "schema_version": 1,
  "evidence_bundle_id": "evidence-npm-leftpad-1.3.0-2026-05-17",
  "package": {
    "ecosystem": "npm",
    "name": "leftpad",
    "version": "1.3.0",
    "canonical": "npm:leftpad@1.3.0",
    "content_hash": "d9b1f3e2c4a5067890abcdef1234567890abcdef1234567890abcdef12345678"
  },
  "scanner_profile_digest": "b7bb9d33748e0eb5bcb74f20ab1e6de126b64e35db2dfa1f4bb830139c8cbad4",
  "analysis_bundles": {
    "policy_bundle_id": "policy-bundle-2026-05-17",
    "feature_schema_id": "feature-schema-v1",
    "expert_bundle_id": "expert-rules-2026-05-17",
    "embedding_model_id": "embedding-disabled-deterministic-v1",
    "index_epoch": "index-epoch-2026-05-17",
    "threshold_profile_id": "threshold-profile-v1",
    "llm_prompt_profile_id": "llm-advisory-disabled-v1"
  },
  "deterministic_risk": {
    "score": 12,
    "band": "low",
    "disposition": "approve",
    "reasons": [
      "No critical deterministic indicators in fixture package"
    ]
  },
  "findings": [],
  "artifacts": {
    "static_analysis_sha256": "18f5384d58bcb1bba0bcd9e6a6781d1a6c1ea7b709eac778c0e74df8556e6b92",
    "yara_report_sha256": "b83d7f0a5f1c2e3b0c4d5a69788766554433221100ffeeddccbbaa9988776655",
    "sandbox_report_sha256": "4b68ab3847feda7d6c62c1fbcbeebfa35eab7351ed5e78f4ddadea5df64b8015"
  },
  "evidence_digest": "1b5e2494714442a1666fed24391d5c2d38a99ee863c6de52c510654a403500b3",
  "signed_by": [
    {
      "key_id": "validator-fixture-key-1",
      "algorithm": "ed25519",
      "signature": "fixture-signature"
    }
  ]
}
